{
  "reqId": "REQ-001",
  "prdId": "PRD-001",
  "title": "Capture markdown notes",
  "description": "The system must let a user write a markdown note and persist it.",
  "category": "functional",
  "domain": "capture",
  "priority": "must",
  "version": "0.1.0",
  "status": "draft",
  "createdAt": "2026-01-01T00:00:00Z",
  "updatedAt": "2026-01-01T00:00:00Z"
}
